ID,Starting_Position1,Starting_Position2,Starting_Position3,Starting_Position4,execution1,execution2,execution3,execution4,Comments_tips1,Comments_tips2,Comments_tips3,Comments_tips4
26,Attach a straight bar to a low cable pulley.,Place a bench next to the pulley and sit facing it.,Grasp the straight bar using a shoulder-width pronated grip (palms facing downward).,null,Exhale as you raise the straight bar by extending your wrists.,Hold for a count of two.,Inhale as you slowly lower the straight bar to the starting position by flexing your wrists.,Repeat for the prescribed number of repetitions.,"The cable should be pulled taut throughout the movement. If it is not, place your forearms on an elevated surface instead of on your thighs. See the first video demonstration.",Keep your spine and neck neutral.,"You can use the cable reverse wrist curl to build forearm mass. However, do not go very heavy with this and other wrist-curling exercises because your wrists are not designed to curl very heavy weights. Exercises for building your forearms that are safer on your wrists include the EZ bar reverse curl, the farmer’s walk, and the dead hang (where you just hang from a bar).",
27,"Holding a barbell with an overhand grip, kneel on the floor with your elbows and forearms placed on a flat bench in front of you.",Let your wrists hang off the edge of the flat bench.,null,null,"Keeping your forearms flat against the bench, exhale as you extend your wrists to raise the bar.",Hold for a count of two.,Inhale as you slowly lower the bar back to the starting position.,Repeat for the desired number of repetitions.,The barbell reverse wrist curl over bench is a great exercise for building the wrist extensor muscles of your forearms.,"Depending on where you position your thumb, the exercise can also be used to strengthen your grip.","You can position your thumb either over or under the barbell. If you position your thumb over the barbell, you will be forced to grip the barbell more tightly with your fingers, thus helping you to improve your grip strength.","Improving grip strength can enhance your performance in other exercises that require a strong grip, such as the barbell deadlift.Also, Keep your arms and body still. Only your wrists should move.Your wrists are not designed to work with heavy weights, so do not go very heavy."
28,Position a preacher bench so that it faces a cable machine.,Grasp the straight bar of the cable machine with an overhand (pronated) grip and sit on the preacher bench.,"Rest your upper arms on the padded surface, in line with your shoulders.",null,Exhale as you slowly curl the straight bar up towards your shoulders.,Hold for a count of two and squeeze your biceps.,Inhale as you slowly lower the straight bar until your elbows are almost fully extended.,Repeat for the prescribed number of repetitions.,Keep your body still; only your forearms should move and keep your elbows in line with your shoulders.,Adjust the seat to ensure that your upper arms lie flat on the padded surface . ,"Keep your reps slow, steady, and controlled to get the most out of the cable reverse preacher curl. By taking out any momentum, you will better isolate, and increase the tension on, the muscles being worked.","The outer (long) head of your biceps brachii is activated more than the inner (short) head is because, at the top of the movement, the inner head develops slack (i.e. enters into active insufficiency). This is true with all preacher curl exercise variations.The reverse preacher curl can also be done using an EZ bar, dumbbells, a barbell, or resistance bands."
29,"Holding a dumbbell in one hand, sit on the preacher bench with the back of your upper arm flat on the arm rest and your elbow flexed.",Rotate your wrist so that your palm faces away from you (pronation).,null,null,"Keeping your wrist pronated, inhale as you lower the dumbbell until your elbow is almost fully extended.  ",Exhale as you bring the dumbbell back up to the starting position by flexing your elbow.,Hold for a count of two and squeeze your biceps.,Repeat steps 1 to 3 for the prescribed number of repetitions then repeat the exercise with your opposite arm.,"To reduce the risk of injuring your elbow, do not lock it out when lowering the dumbbell.","If you do not have access to a preacher bench, you may use an inclined bench by standing behind it and resting the back of your upper arm on the top of the bench. The top of the bench should be under your armpit.","Depending on your grip type and the position of your elbow, the target muscle in elbow-flexion exercises can be either your biceps brachii, brachialis, or brachioradialis. In this exercise, a pronated grip is used, which puts the biceps brachii at a mechanical disadvantage and makes the brachioradialis the target.","You may perform this exercise one arm at a time, as described, or with both arms simultaneously, as in the dumbbell reverse preacher curl."
30,"Stand holding an EZ-curl bar using a close supinated grip (hands closer than shoulder width apart and palms facing upward). Your elbows should be almost fully extended, and the bar should be resting against your thighs.",null,null,null,"Keeping your elbows fixed to your sides, exhale as you curl the EZ-curl bar up toward your shoulders.",Hold for a count of two and squeeze your biceps.,Inhale as you lower the EZ-curl bar to the starting position.,Repeat for the prescribed number of repetitions.,"Your biceps brachii has two heads: short (inner) and long (outer). The long head makes up the majority of the biceps’ peak, whereas the short head sits on the inner side and contributes to the biceps’ width. The close-grip EZ bar curl will emphasize the long head and build the peak of your biceps. The wide-grip EZ bar curl will emphasize the short head and give your biceps more width. The standard (shoulder-width) EZ bar curl will place approximately equal emphasis on both heads.","An easy way to remember whether you’re working the short/inner or long/outer head of the biceps brachii is to look in the mirror. When using a close grip, which, as explained above, targets the long head, the long head will be visible. When using a wide grip, which targets the short head, the short head will be visible.",Keep your elbows locked to your sides and your body still. Only your forearms should move.,"Using the EZ-curl bar instead of a standard barbell to do biceps curls reduces the pressure on your wrists. However, the camber (bend) of the EZ-curl bar must be minimal. The steeper the camber, the more emphasis you will place on your brachioradialis instead of your biceps brachii. Therefore, if a standard barbell doesn’t hurt your wrists, use that instead of the EZ-curl bar."
31,Place a bench under a high cable pulley.,Lie on the bench so that your face is positioned under the straight bar.,Grasp the bar using a shoulder-width supinated (underhand) grip. The cable should be taut and your arms should be almost fully extended.,null,"Keeping your upper arms still and your body flat on the bench, exhale as you curl the bar towards your forehead until your elbows are fully flexed.",Hold for a count of two and squeeze your biceps.,"Inhale as you reverse the movement and return the bar to the starting position, with your arms almost fully extended.",Repeat for the prescribed number of repetitions.,The point of lying down is to ensure that your body stays still. This prevents cheating and better isolates your elbow flexors.,Keep your upper arms still. Only your forearms should move and keep your elbows in line with your shoulders.,"As with the dumbbell preacher curl, when you perform the lying high cable curl, the long head of your biceps brachii is activated more than is the short head. The reason is that, at the top of the repetition, the short head develops slack (i.e. it enters into active insufficiency).","The straight bar can be hard on some people’s wrists. If that is the case with you, you can use a wavy bar and  lying high cable curl is also known as the supine high cable curl."
32,Sit on the edge of a chair so that only your buttocks rest on the seat. Your knees should be bent.,"With your right hand, grasp your left leg from under the knee.",null,null,"Keeping your left leg completely relaxed, exhale as you lift it off the floor with your arm by flexing your elbow.",Hold for a count of two and squeeze your biceps.,Inhale as you lower your leg to the starting position.,Repeat for the prescribed number of repetitions and repeat the exercise with your left arm.,Do not allow your elbow to pivot on your thigh.,Try to get as much range of motion as possible.,"The biceps leg curl is a poor exercise, with a limited range of motion. Use it only as a last resort if you can’t make it to the gym, and if you do not have anything else to curl, such as dumbbells or barbells.",null
33,"Lie on your left side with your hips and knees flexed, and with a cushion under your elbow.","With your left hand, grasp your left thigh under the knee.",Place your right hand behind your head.,null,Exhale as you raise your torso by flexing both your elbow and your waist.,Hold for a count of two and squeeze your biceps brachii.,Inhale as you lower your torso to the starting position.,Repeat for the prescribed number of repetitions and  repeat the exercise with your right arm.,"The side-lying biceps bodyweight curl is a poor exercise. However, it can help you to work your biceps in the absence of dumbbells and barbells.","The weight of your torso will be too heavy for your biceps, which is why you also have to flex your waist.","The side-lying biceps bodyweight curl is awkward and requires practice. As you practice, try to minimize waist flexion, emphasize elbow flexion, and get as much range of motion as possible in your elbow.","In the absence of dumbbells and barbells, you can also use the biceps leg curl."
34,"Get on your hands and knees, with hands shoulder-width apart.","Lower your elbows to the floor, shoulder-width apart.",Lean forward so that your bodyweight is supported by your elbows.,null,Exhale as you push your body off the floor by extending your elbows.,Inhale as you lower your elbows to the starting position by flexing your elbows.,Repeat for the prescribed number of repetitions.,null,"Keep your elbows tucked in to your body. Do not flare them out.When done in good form, the kneeling bodyweight triceps extension almost completely isolates the triceps brachii. The weaker the triceps are, the more the pectoralis major, anterior deltoid, and biceps brachii (short head only) have to get involved to complete the movement.","Even though there is movement in both the elbows and shoulders, the kneeling bodyweight triceps extension has been classified as an isolation exercise because movement in the shoulders is minimal when performed in good form.To make the kneeling bodyweight triceps extension more difficult, either move your knees backward or lean forward so that more of your body weight is over your hands. You can also try the bodyweight triceps extension, which is the advanced form of the exercise.","If this exercise hurts your wrists, avoid it.Use the kneeling bodyweight triceps extension when you need to isolate your triceps brachii in the absence of dumbbells, barbells, and weight machines.","Instead of kneeling on the floor, you can lean against a wall."
35,Lie on your back (supine) on a flat bench.,"Dismount the barbell using a pronated (overhand), shoulder-width grip and hold the barbell over your forehead so that your arms are slightly slanted backwards.",null,null,"Keeping your upper arms still, inhale as you lower the barbell toward your forehead in a smooth, semicircular motion by flexing your elbows.",Exhale as you reverse the movement and push the barbell back up to the starting position by extending your elbows.,Repeat for the prescribed number of repetitions.,null,Keep your shoulders and upper arms fixed. All of the movement should be in your elbows.,"Do not allow your elbows to flare out, as this will allow your pectoralis major and anterior deltoid to get involved, which will take the emphasis away from your triceps brachii.","The point of holding the bar over your forehead in the starting position is to ensure that your arms are slightly slanted backwards, which will ensure that tension is kept on your triceps throughout the movement.","For obvious reasons the barbell skull crusher can be dangerous. Start light, add weight gradually, and always keep the movement under full control."
36,Stand holding a barbell with a wide overhand (pronated) grip.,"Flex your hips and knees until your torso is horizontal, and allow the barbell to hang straight down.",null,null,"Keeping your elbows perpendicular to your torso, exhale as you pull the barbell up toward your chest.",Hold for a count of two.,Inhale as you lower the barbell back to starting position in a controlled manner.,Repeat the barbell rear delt row for the prescribed number of repetitions.,"To target the posterior deltoids, your elbows must be kept perpendicular to your torso. This allows horizontal shoulder extension, the movement pattern in which the posterior deltoid is the primary mover. Learn more about horizontal pulling exercises in which you keep your elbows perpendicular to your torso.",Keep your torso horizontal and still; only your arms should move. This prevents cheating and keeps the focus on the target and synergistic muscles.,"If your lower back becomes rounded, bend your knees more. Prioritize good form as this reduces the risk of lower back injury.","To target your posterior deltoids, you can also look into the bent-over barbell reverse raise and the standing cable rear delt row with rope."
37,Stand in front of a pulley set at approximately head height.,Grasp one end of the rope attachment in each hand using a supinated (underhand) grip.,Step backward so that the rope is taut and your arms are stretched out in front of you.,Assume a staggered stance (place one foot in front of the other) and lean backward to help you balance.,Exhale as you pull the rope toward your forehead.,"As the rope nears your face, externally rotate your shoulders so that you end up making a double biceps pose.",Hold for a count of two.,Inhale as you reverse the motion and return the rope to the starting position in a controlled manner then repeat,"Keep the flexing of your elbows to a minimum. This will keep as much movement as possible in your shoulders, where it belongs.",Avoid swaying back and forth to complete the reps.Keep the movement in your shoulders.,"Don’t go too heavy, as this often leads to swaying.",The face pull can also be performed with dumbbells.
38,"Stand up straight, holding a weight plate in front of your thighs with both hands. Your hands should be at the three and nine o’clock positions.",null,null,null,"Keeping your back straight and your elbows slightly bent, exhale as you raise the plate out in front of you in an arcing motion until your arms are parallel with the floor.",Hold for a count of two.,Inhale as you lower the plate in a controlled manner to the starting position then repeat,null,Keep your body still. Don’t sway back and forth as you raise and lower the weight plate.,You can reduce your potential to cheat during the plate front raise by sitting down and lowering the plate to between your legs.,"If you lift heavy, the weight plate front raise will significantly challenge your core and especially your lower back. Therefore, increase weight gradually to give your lower back time to adapt.",Keeping a slight bend in your knees can help to decrease the pressure on your lower back.
39,"Holding a dumbbell in each hand, sit on a chair or bench and allow the dumbbells to hang straight down by your sides.",null,null,null,"Keeping your elbows very slightly flexed, exhale as you raise the dumbbells forward and upward in a semicircular motion until your arms rise a little above horizontal.",Hold for a count of two.,Inhale as you lower the dumbbells in a controlled manner to the starting position.,Repeat for the prescribed number of repetitions.,Do not swing the dumbbells.,Keep your back neutral and against the back support (if sitting on a chair).,"Only your arms should move. Keep your body still.If you must sway your body back and forth to raise the dumbbells, the dumbbells are too heavy. Reduce the weight.","There are different ways in which you can hold the dumbbells during the seated dumbbell front raise. You can maintain a neutral (hammer) grip or a pronated (overhand) grip throughout the movement. As in the illustration, you can also start off the raise using a neutral grip and, as your arms pass your legs, you can rotate (pronate) your wrists so that your palms face downward at the top of the movement. I recommend that you maintain a neutral grip, as this reduces the chances of shoulder impingement."
40,"With a dumbbell in each hand, stand with your arms in a ‘W’ position.",null,null,null,"Keeping your elbows fixed, exhale as you raise the dumbbells in a circular motion until they nearly touch each other over your head.",Inhale as you return the dumbbells to the starting position.,Repeat for the prescribed number of repetitions.,null,Keep your elbows locked. They must neither flex nor extend.,"The dumbbell w-press is quite a rare exercise but very effective at overloading the anterior and lateral deltoids. Because the elbows are kept fixed, there is no involvement of the triceps brachii.","If experienced and struggling to get more growth in your shoulders, you can use the dumbbell w-press to pre-exhaust your shoulders before hitting them with the dumbbell or barbell overhead press.",Do not confuse the dumbbell w-press with the dumbbell Arnold press.
41,"Stand with a loaded barbell behind your feet, on the floor.",Squat and pick up the barbell so that you are holding it behind your back.,Flex your hips and knees until either your torso is horizontal or you feel a mild stretch in your hamstrings. The barbell should be resting on your calves.,null,"Keeping your back and neck neutral and your arms straight, exhale as you raise the barbell upward as far as you can.",Hold for a count of two.,"Inhale as you slowly lower the barbell toward the starting position, stopping before the barbell touches your calves and repeat",null,Keep your body still. Only your arms should move.,Do not raise the bar beyond feeling a mild stretch in your shoulders.,"The bent-over barbell reverse raise is a rare exercise but very effective at activating the posterior deltoid. The synergists (latissimus dorsi, teres major, sternal pectoralis major, and the long head of your triceps brachii) are involved in the movement only up to the point of where your upper arms are directly by your side. Beyond this point (shoulder hyperextension), only your posterior deltoid is involved to a significant degree, with your triceps brachii acting as an important stabilizer.",Also known as the bent-over behind-the-back barbell reverse raise and the bent-over behind-the-back rear delt raise.
42,"Holding a dumbbell in each hand, sit on the edge of a bench.",Position the dumbbells by your sides.,null,null,"Keeping your elbow slightly bent and your back straight, exhale as you raise one dumbbell forward and upward in a semicircular motion until your arm is a little over horizontal.",Hold for a count of two.,Inhale as you reverse the motion and lower your arm to the starting position as you raise your opposite arm forward and upward.,"Keep repeating, alternating the arm that you raise.","Keep your body still. Only your arms should move. If you must sway back and forth to raise the dumbbells, they are too heavy.","You can use a hammer (neutral) grip, as in the illustration, or a pronated (overhand) grip. A neutral grip may be easier on your shoulder joints. You can also start off the raise using a neutral grip and, as your arm passes your leg, you can twist it so that it is pronated by the top of the movement. See the video.","Instead of alternating your arms, you can of course raise both arms together.",The seated alternating dumbbell front raise is great for building the anterior and lateral portions of your deltoids.
43,"Lie on your side, either supporting your upper body on your elbow and forearm, resting your head in your hand, or even resting your head on a pillow.","Grasp a dumbbell with your free hand, bend your elbow to a 90-degree angle, rest your elbow against your side, and lower your forearm across your belly.",null,null,"Keeping your elbow against your side, exhale as you raise the dumbbell as high as possible by externally rotating your shoulder.",Hold for a count of two.,Inhale as you slowly lower the dumbbell across your belly and repeat,Repeat with your other arm while lying on your opposite side.,Keep your elbow bent at a 90-degree angle.,"Keep your elbow against your side. If it keeps rising off, it means that you’re using too heavy a weight and that your lateral deltoid is being recruited to complete the rep.",null,null
44,"Holding a dumbbell in each hand, bend at the hips and knees until your torso is parallel to the floor. Your back should be straight and your arms should be hanging in front of you, with your palms facing inwards (neutral grip).",null,null,null,"Keeping your elbows slightly bent, raise both arms out to the sides until the dumbbells are level with the height of your shoulders. Don’t forget to exhale.",Hold for a count of two.,Inhale as you lower the dumbbells to the starting position in a controlled manner.,Repeat for the desired number of repetitions.,Do not swing the dumbbells upward.  ,Try to resist the lowering of the dumbbells.,Keep your back straight and your body still.,You will not target your posterior deltoids unless your torso is horizontal and your upper arms are perpendicular to your torso.
45,Attach a stirrup (handle) to a low cable pulley.,Grasp the stirrup with one hand and step forward until the cable is pulled taut and your arm is left by your side and a little behind you.,"For balance, stagger your feet. The foot in front should be the one that is opposite to your working arm.",null,"Keeping your elbow very slightly flexed, exhale as you raise the stirrup forward and upward in a semicircular motion until your arm is above horizontal. And hold for a count of two",Inhale as you slowly reverse the motion and lower the stirrup to the starting position.,Repeat for more repetitions.,Repeat the exercise with your opposite arm.,Keep your back straight and your head up.,Keep your body still. Only your arm should move.,Do not allow your body to twist.,"While performing the cable one-arm front raise, if you feel pain in your shoulder, you’re probably raising the stirrup too high. If you continue to feel pain despite reducing the height of the movement, please stop using the exercise."
46,"Holding a loaded barbell with a shoulder-width, pronated (overhand) grip, lie prone (on your front) on a bench inclined at 45 or more degrees and allow the barbell to hang straight down.",null,null,null,Exhale as you pull the barbell up to your lower chest.,Hold for a count of two.,Inhale as you lower the barbell to the starting position.,Repeat for the prescribed number of repetitions.,"Although the upper trapezius and levator scapulae only act as stabilizers, they are significantly activated when heavy weights are used","For shoulder safety, avoid using a narrow grip with all upright rowing exercises.",null,null
47,Raise a bench to hip height.,Grasp a dumbbell in each hand and stand behind the bench.,"Flex your hips and rest your forehead on the edge of the bench. Your back should be straight, your torso should be horizontal, and your arms should be hanging straight down in front of you, with your palms facing inward (neutral or hammer grip).",null,"Keeping your elbows slightly flexed, exhale as you raise both arms out to the sides until your elbows are level with your shoulders. At the top of the movement, your pinky finger should be higher than your other fingers.",Hold for a count of two.,Inhale as you slowly lower the dumbbells to the starting position.,Repeat.,"Keep your back straight,and keep your body still. Only your arms should move.","Do not swing the dumbbells upward and do not allow them to drop downward. Keep the movement under full control. and keep your head in contact with the bench. The whole point of resting your head on the edge of a bench is to make sure that your body stays still and doesn’t sway up and down. In other words, it prevents you from cheating.","To target your posterior deltoids during the head-supported reverse dumbbell fly, keep your torso horizontal. The more upright your torso is, the more emphasis you will place on your lateral deltoids instead of on your posterior deltoids.","To avoid the involvement of your latissimus dorsi, keep your upper arms perpendicular to your torso."
